id;ano_contratacao;titulo;objetivo;grupo_tematico;subgrupo_tematico;tipo_pesquisa;programa;instituicao;sigla_instituicao;uf_instituicao;valor_projeto;status;ano_previsao
1;2021;Estudo de Efetividade da Vacina Covid-19 Recombinante/Fiocruz contra diferentes variantes do SARS-CoV-2 na região de Botucatu-SP;Avaliar a efetividade de uma (1) dose da vacina Covid-19 Recombinante/Fiocruz para proteger contra qualquer doença de Covid-19 confirmada por laboratório, causada por qualquer cepa e pela variante P1, a partir de 3 semanas após a dose 1, e após a vacinação completa (2 semanas após a dose 2);Prevenção;Vacinas e Imunização;Avaliação de Tecnologias em Saúde;Sem programa vinculado;Universidade Estadual Paulista Júlio de Mesquita Filho;UNESP;SP;10881828;Finalizado;2022
2;2021;Estudo de fase 4, randomizado, controlado, simples cego para avaliar a imunogenicidade e a segurança de uma terceira dose de reforço com vacinas Covid-19 em adultos.;Avaliar a imunogenicidade de uma dose de reforço de diferentes vacinas anti-Covid-19 em indivíduos previamente vacinados com o esquema de duas doses de Sinovac/Butantan. A comparação será realizada em grupos submetidos a um reforço heterólogo utilizando a vacina Covid-19 recombinante (AstraZeneca/Fiocruz), vacina Covid-19 RNAm (Pfizer/Wyeth) ou vacina Covid-19 recombinante (Janssen) e o grupo controle que receberá o reforço homólogo da vacina adsorvida Covid-19 inativada Sinovac/Butantan;Prevenção;Vacinas e Imunização;Pesquisa Clínica Intervencional (Fases I, II, III);Sem programa vinculado;Instituto D'Or de Pesquisa e Ensino;IDOR;SP;13396350;Finalizado;2022
3;2021;Avaliação dos parâmetros evolutivos da hemostasia na infecção por SARS-CoV-2 e estratégias de intervenção através de ensaio clínico adaptativo ;Avaliar o compartamento evolutivo da hemostasia na infecção por SARS-CoV-2 e avaliar o impacto de intervenções terapêuticas de anticoagulação e antiagregação plaquetária nos defechos clínicos de pacientes infectados;Tratamento;Manejo Clínico pacientes com COVID-19;Pesquisa Clínica Intervencional (Fases I, II, III);Sem programa vinculado;Fundação Faculdade de Medicina;FFM;SP;287509;Finalizado;2025
4;2022;Avaliação pré-clínica da segurança, imunogenicidade e eficácia da vacina MultiCoVax;Desenvolver uma vacina nasal contra o SARS-CoV-2 - MultiCoVax - contendo formulação inovadora composta por um antígeno quimérico, capaz de induzir respostas imunes humoral e celular, sistêmicas e de mucosa, oferecendo potencial de bloqueio da transmissão viral;Prevenção;Vacinas e Imunização;Pesquisa Pré-Clínica;Sem programa vinculado;Universidade de São Paulo;USP;SP;1680360,44;Em execução;2025
5;2022;Desenvolvimento de vacinas RNA autoreplicadas para prevenção de doenças infecciosas e a preparação para novas emergências sanitárias;Aperfeiçoar a plataforma RNA estabelecida pelo grupo de estudo utilizando como modelos duas doenças de grande importância para a saúde pública: Covid-19 e Varíola dos Macacos (Monkeypox);Prevenção;Vacinas e Imunização;Pesquisa Pré-Clínica;Sem programa vinculado;Fundação Oswaldo Cruz;FIOCRUZ;RJ;849000;Em execução;2025
6;2022;Uso de um novo agente para delivery de vacinas de mRNA e DNA;Desenvolvimento pré-clínico de uma ferramenta de entrega intracelular de vacinas de mRNA e DNA, baseada em um complexo da proteína C de DENV ou peptídeos derivados desta, e DOTAP, utilizando DNA e mRNA de luciferase (gene repórter) e da proteína S de SARS-CoV-2 (gene de interesse), e comprovar sua eficácia em modelos de comundongo transgênico suscetíveis ao SARS-CoV-2 (k18-hACE);Prevenção;Vacinas e Imunização;Pesquisa Pré-Clínica;Sem programa vinculado;Universidade Federal do Rio de Janeiro;UFRJ;RJ;1261320;Em execução;2025
7;2022;Desenvolvimento de vacina contra Covid-19 baseada em BCG recombinante com reforço heterólogo de vacina de DNA, ambos expressando antígenos de SARS-CoV-2;Desenvolvimento de uma vacina contra Covid-19 que induza uma imunidade mais duradoura, abrangendo as diversas variantes e envolvendo baixos custos de produção;Prevenção;Vacinas e Imunização;Pesquisa Pré-Clínica;Sem programa vinculado;Instituto Butantan;IBU;SP;1475140;Em execução;2025
8;2022;Desenvolvimento de plataforma vacinal baseada em vetores plasmidiais para doenças respiratórias: aplicação para infecções endêmicas/pandêmicas das vias aéreas;Desenvolver plataforma vacinal baseada em vatores plasmidiais de expressão para indução de resposta celular, humoral e proteção contra infecções com SARS-CoV-2 e influenza;Prevenção;Vacinas e Imunização;Pesquisa Pré-Clínica;Sem programa vinculado;Fundação Oswaldo Cruz;FIOCRUZ;MG;1554400;Em execução;2025
9;2022;Desenvolvimento e avaliação de adjuvantes nano particulados miméticos a patógenos e carreadores de mRNA como potenciais sistemas de vacinação;Caracterizar e validar as nanopartículas de albumina sérica bovina miméticas a patógenos e carreadoras de mRNA como sistemas vacinais que possam ser utilizados na prevenção de doenças infectocontagiosas;Prevenção;Vacinas e Imunização;Pesquisa Pré-Clínica;Sem programa vinculado;Universidade Federal de Alfenas;UNIFAL;MG;215480;Em execução;2026
10;2024;Ensaio Clínico para validação de usabilidade de dispositivo de acesso à via aérea com inserção da visão computacional em emergências de saúde pública;Ensaio Clínico de videolaringoscópio com recursos de inteligência artificial e visão computacional no acesso à via aérea em situações de moderada a grave disfunção respiratória por doenças epidêmicas;Tratamento;Manejo Clínico pacientes com COVID-19;Avaliação de Tecnologias em Saúde;Sem programa vinculado;Hospital Escola da Universidade Federal de Pelotas;HE-UFPEL;RS;1796160;Em execução;2027
11;2024;Estratégias neuroprotetoras de amplo acesso para emergências de saúde pública virais: Uma abordagem pré-clínica focada em mecanismos inflamatórios e reposicionamento de fármacos;Caracterizar a resposta neuroinflamatória e metabólica em modelos pré-clínicos expostos a partículas (ou proteínas) virais de SARS-CoV-2, MPXV e de arbovírus (ZIKV, DENV e OROV) e a soros de pacientes infectados, bem como investigar potenciais estratégias neuroprotetoras como metformina e nifedipina (fármacos já distribuídos pelo SUS) e com outros compostos bioativos como resveratrol e sulforafano, em formulações nanotecnológicas;Tratamento;Medicamentos;Pesquisa Pré-Clínica;Sem programa vinculado;Universidade Federal do Rio Grande do Sul;UFRGS;RS;142000;Em execução;2027
12;2021;Monitoramento Genômico Do Sars-Cov-2 E Das Vocs (Variants Of Concern) Face Às Condições Epidemiológicas Emergentes No Brasil Através Da Rede Genômica Fiocruz.;Caracterizar, por meio do sequenciamento do genoma viral, as linhagens dos vírus circulantes em diferentes estados e sua prevalência ao longo do tempo, de relacionar ao número de casos notificados de doença respiratória aguda grave (SARI) e de descrever características e desfechos clínicos associados. Além disso, serão avaliadas se as novas VOCs detectadas são capazes de escape imunológico e maior potencial de transmissão em ensaios in silico e in vitro. Por último, o banco genômico gerado será utilizado para avaliar em tempo real o impacto das novas variantes nos kits de diagnóstico para o vírus. Análises preliminares dos achados serão realizadas e divulgadas por meio de relatórios oficiais para o MS e LACENs e no site da Rede Genômica Fiocruz (http://www.genomahcov.fiocruz.br/).;Fortalecimento do SUS e Vigilância em Saúde;Vigilância Genômica;Pesquisa Observacional;GENOMAS Brasil;Fundação Oswaldo Cruz;FIOCRUZ;RJ;37000000;Finalizado;2024
13;2023;Desenho racional e produção de proteínas multiepítopo de SARS-CoV-2: uma abordagem para a produção de imunoterápicos.;Desenvolver uma estratégia terapêutica para a Covid-19 usando a hipótese de uma abordagem computacional para identificar os epítopos mais imunogênicos das proteínas do SARS-CoV-2 e com isso construir uma proteína multiepítopo capaz de elicitar uma forte resposta humoral. A qualidade e estabilidade da proteína teórica será avaliada in sílico antes da expressão da mesma em sistemas eucariotos. Nosso objetivo, além da produção de uma nova molécula, é utilizar o antígeno recombinante para elicitar uma resposta imune em camundongos BALB/c e avaliar a resposta dos anticorpos heterólogos neutralizantes quanto ao seu potencial em neutralizar a infecção de SARS-CoV-2 em curso.;Tratamento;Medicamentos;Pesquisa Pré-Clínica;GENOMAS Brasil;Universidade Federal do Rio de Janeiro;UFRJ;RJ;393320;Em execução;2026
14;2020;Estudo Multicêntrico De Fase I / Iia Sobre O Uso De Células Estromais Mesenquimais No Tratamento De Pacientes Com Pneumonia Por Sars-Cov-2;Recentemente, as células-tronco mesenquimais (CTMs) foram introduzidas, ainda de forma experimental, como uma das terapêuticas para uso no tratamento da Covid-19. Estas células têm potencial imunomodulador, efeitos antimicrobianos, capacidade de reparo tecidual, além de serem imunoprivilegiadas e também não serem infectadas pelo SARS-CoV-2. O tecido do cordão umbilical (TCU) é uma fonte de CTMs muito atrativa para a terapia celular devido à grande capacidade proliferativa destas células, e, nesta pesquisa foi a escolha dos pesquisadores. Serão utilizadas células de cordões umbilicais existentes num biobanco específico de pesquisa no tratamento que será avaliado neste estudo. Análises recentes, utilizando CTMS-TCU para tratamento da Covid-19, mostram que o procedimento é seguro e levou a uma diminuição de citocinas inflamatórias, aumento de células reguladoras e reparo pulmonar. Assim, este estudo clínico multicêntrico avaliará a viabilidade, a segurança e a eficácia clínica da infusão intravenosa de células-tronco mesenquimais alogênicas de cordão umbilical para o tratamento da pneumonia causada pela infecção do SARS-CoV-2.;Tratamento;Medicamentos;Pesquisa Clínica Intervencional (Fases I, II, III);GENOMAS Brasil;Pontifícia Universidade Católica do Paraná;PUC-PR;PR;2458155;Finalizado;2024
15;2020;Coalizão multiômicas para o estudo da pandemia de Covid-19 na população brasileira: eixo transcritoma e imunofenotipagem.;Caracterização de perfis genômicos, moleculares e celulares em indivíduos nonagenários e centenários recuperados da infecção pelo novo coronavírus SARS-CoV-2 (Covid-19) em comparação com controles que desenvolveram formas graves de Covid-19 e em pares de gêmeos.;Prevenção;Outros estudos de prevenção;Pesquisa Pré-Clínica;GENOMAS Brasil;Universidade de São Paulo;USP;SP;5150726,36;Em execução;2025
16;2020;Coalizão multiômicas para o estudo da pandemia de Covid-19 na população brasileira: eixo genômica viral.;Estudar indivíduos de populações nativo-americanas brasileiras (Tupiniquim e Guarani-Mbyá) para compreender as relações entre variabilidade genética autóctone, condições clínicas preexistentes e susceptibilidade à Covid-19, através do sequenciamento de genomas completos e análise de variantes genéticas relacionadas aos desfechos clínicos da doença. A pesquisa busca também realizar vigilância genômica do SARS-CoV-2, investigando como a ancestralidade nativa (presente em 7-22% da população brasileira) influencia na resposta ao vírus, considerando diferentes graus de miscigenação e exposição urbana dessas populações historicamente vulneráveis.;Fortalecimento do SUS e Vigilância em Saúde;Vigilância Genômica;Pesquisa Pré-Clínica;GENOMAS Brasil;Laboratório Nacional de Computação Científica;LNCC;RJ;1302733,13;Finalizado;2023
17;2020;Coalizão multiômicas para o estudo da pandemia de Covid-19 na população brasileira: eixo genômica humana.;O projeto terá como objetivo estudos de identificação e caracterização de fatores genômicos virais e além disso, estudar a interação vírus-hospedeiro associado às manifestações clínicas da doença, através da utilização de dados de ômica (genômica viral, transcritomas humanos, genoma completo humano). ;Prevenção;Outros estudos de prevenção;Pesquisa Pré-Clínica;GENOMAS Brasil;Universidade de São Paulo;USP;SP;396000;Finalizado;2023
18;2020;Coalizão multiômicas para o estudo da pandemia de Covid-19 na população brasileira: eixo proteômica e metabolômica.;A presente proposta tem por objetivo geral realizar uma ampla varredura de fatores individuais que podem conferir proteção/susceptibilidade a diferentes desfechos da infecção por SARS-CoV-2 na população brasileira e influenciar no desenvolvimento das manifestações clínicas, utilizando uma abordagem integrada por meio da agregação de dados clínicos a múltiplas informações ômicas – que incluem informações genômicas, do transcriptôma, proteômicas e metabolômicas –, imunológicas (imunofenotipagem) e do genoma viral, sendo este último importante para compreensão dos fatores externos de co-infecção e da própria evolução do vírus no país. ;Prevenção;Outros estudos de prevenção;Pesquisa Pré-Clínica;GENOMAS Brasil;Universidade Federal do Rio de Janeiro;UFRJ;RJ;1795040,51;Finalizado;2024
19;2021;Estudo randomizado prospectivo comparando diferentes estratégias ventilatórias em pacientes com Síndrome do Desconforto Respiratório Agudo por pneumonia comunitária: Estudo STAMINA.;Avaliar se uma estratégia de titulação de Pressão Expiratória Positiva Final (PEEP) guiada por complacência, sem manobra de recrutamento, é superior em termos de aumento do número de dias livres de suporte ventilatório invasivo em comparação à estratégia padrão que se baseia na titulação da PEEP e da Fração Inspirada de Oxigênio (FIO2). ;Tratamento;Manejo Clínico pacientes com COVID-19;Pesquisa Clínica Intervencional (Fases I, II, III);PROADI - SUS;Associação Beneficente Síria;ABS;SP;2014665,2;Finalizado;2023
20;2021;Impacto em longo prazo da Covid-19 na população brasileira - Estudo de coorte prospectiva de casos moderados a graves (hospitalizados) (Estudo 1).;"Avaliar a ocorrência e os fatores de risco modificáveis para os seguintes desfechos de longo prazo: Qualidade de vida relacionada à saúde; Mortalidade 1 ano após alta hospitalar; Taxa de re-hospitalização não planejada precoce e tardia; Presença de sintomas prolongados;  Capacidade física funcional; Função cognitiva; Sintomas de ansiedade e depressão; Sintomas de transtorno de estresse pós-traumático.";Pós-covid;Condições Pós-Covid;Pesquisa Observacional;PROADI - SUS;Associação Hospitalar Moinhos de Vento;HMV;RS;1556875,37;Finalizado;2023
21;2021;Impacto em longo prazo da Covid-19 na população brasileira - Estudo de coorte prospectiva de casos leves (não-hospitalizados) (Estudo 2).;"Avaliar a ocorrência e os fatores de risco modificáveis para os seguintes desfechos de longo prazo: Qualidade de vida relacionada à saúde; Mortalidade 1 ano após início dos sintomas da Covid-19; Taxa de hospitalização não planejada; Presença de sintomas prolongados; Capacidade física funcional; Função cognitiva; Sintomas de ansiedade e depressão; Sintomas de transtorno de estresse pós-traumático.";Pós-covid;Condições Pós-Covid;Pesquisa Observacional;PROADI - SUS;Associação Hospitalar Moinhos de Vento;HMV;RS;1556875,37;Finalizado;2023
22;2021;Impacto em longo prazo da Covid-19 na população brasileira - Estudo caso-controle para avaliar o risco atribuível da Covid-19 no acometimento da saúde cardiorrespiratória 6 meses após contrair pneumonia (Estudo 3).;"Avaliar o risco atribuível da Covid-19 no desenvolvimento dos seguintes desfechos em 6 meses (caso-controle): Capacidade de difusão pulmonar; Capacidade vital, volume expiratório forçado no primeiro segundo (VEF1) e VEF1/CV; Padrões radiológicos de fibrose pulmonar; Equivalente metabólicos; Escore de cálcio coronariano; Marcadores inflamatórios;  Dispneia; Eventos cardiovasculares maiores; Eventos tromboembólicos.";Pós-covid;Condições Pós-Covid;Pesquisa Observacional;PROADI - SUS;Associação Hospitalar Moinhos de Vento;HMV;RS;1556875,38;Finalizado;2023
23;2023;Impacto em longo prazo da Covid-19 na população brasileira - Estudo de coorte para avaliação do impacto em longo prazo da Covid-19 no Brasil (pacientes hospitalizados) - Coorte de casos moderados a graves (Estudo 1).;"Avaliar a ocorrência e os fatores de risco modificáveis para os seguintes desfechos de longo prazo: Qualidade de vida relacionada à saúde; Mortalidade 1 ano após alta hospitalar;  Taxa de re-hospitalização não planejada precoce  e tardia; Presença de sintomas prolongados; Capacidade física funcional; Função cognitiva; Sintomas de ansiedade e depressão; Sintomas de transtorno de estresse pós-traumático. ";Pós-covid;Condições Pós-Covid;Pesquisa Observacional;PROADI - SUS;Associação Hospitalar Moinhos de Vento;HMV;RS;593961,34;Finalizado;2025
24;2023;Impacto em longo prazo da Covid-19 na população brasileira - Estudo de coorte para avaliação do impacto em longo prazo da Covid-19 no Brasil (pacientes ambulatoriais) - Coorte de casos leves (Estudo 2).;"Avaliar a ocorrência e os fatores de risco modificáveis para os seguintes desfechos de longo prazo: Qualidade de vida relacionada à saúde avaliada pela escala da EuroQol de 5 dimensões e 3 níveis; Mortalidade 1 ano após início dos sintomas da Covid-19; Taxa de hospitalização não planejada; Presença de sintomas prolongados; Capacidade física funcional; Função cognitiva; Sintomas de ansiedade e depressão; Sintomas de transtorno de estresse pós-traumático.

";Pós-covid;Condições Pós-Covid;Pesquisa Observacional;PROADI - SUS;Associação Hospitalar Moinhos de Vento;HMV;RS;593961,35;Finalizado;2025
25;2023;Impacto em longo prazo da Covid-19 na população brasileira - Estudo observacional de pacientes com Síndrome do Desconforto Respiratório Agudo (SDRA) e controles - Caso-controle, comparando indivíduos hospitalizados por pneumonia por SARSCoV-2 e controles sem histórico de sintomas persistentes da Covid-19 (Estudo 3).;"Avaliar o impacto da SDRA por Covid-19 nos seguintes desfechos a partir de 12 meses após alta hospitalar: Capacidade física-funcional; Atividades instrumentais de vida diária; Função e força muscular;  Dispneia; Qualidade de vida relacionada à saúde; Variáveis ergoespirométricas como consumo direto de oxigênio, consumo de oxigênio de pico, VE/VCO2 slope, oxygen uptake efficiency slope;  Variáveis espirométricas como capacidade vital, volume expiratório forçado no primeiro segundo; Padrões radiológicos de fibrose pulmonar,  relacionados à sequelas de miocardite aguda e  de sarcopenia; Avaliação estrutural e de função renal; avaliar desfechos na internação e após a alta hospitalar por SDRA: eventos cardiovasculares maiores; Eventos tromboembólicos.";Pós-covid;Condições Pós-Covid;Pesquisa Observacional;PROADI - SUS;Associação Hospitalar Moinhos de Vento;HMV;RS;593961,35;Finalizado;2025
26;2022;Ensaio clínico randomizado em cluster, stepped-wedge, para avaliação do impacto de bundles de reabilitação precoce (apoiados por Telemedicina) na qualidade de vida de pacientes após insuficiência respiratória aguda hipoxêmica com suspeita de Covid-19.;Avaliar o impacto de intervenções precoces (incluindo bundles específicos de prevenção/reabilitação precoce e estratégias de desospitalização) em desfechos de interesse de curto prazo (tempo de permanência e mortalidade hospitalar, savings) e longo prazo (com ênfase desfechos funcionais como qualidade de vida, taxa de retorno ao trabalho e internações, entre outros) em pacientes graves acometidos pela long-covid.;Pós-covid;Condições Pós-Covid;Pesquisa Clínica Intervencional (Fases I, II, III);PROADI - SUS;Associação Hospitalar Moinhos de Vento;HMV;RS;2808872,51;Finalizado;2023
27;2023;Ensaio clínico randomizado em cluster, stepped-wedge, para avaliação do impacto de bundles de reabilitação precoce (apoiados por telemedicina) na qualidade de vida de pacientes após insuficiência respiratória aguda hipoxêmica com suspeita de Covid-19.;Avaliar, por meio de ensaio clínico randomizado em cluster, stepped-wedge, o impacto de bundles específicos de prevenção/reabilitação precoce, focados em três domínios (UTI, Enfermaria e pós alta), em qualidade de vida relacionada à saúde e outros desfechos de longo e curto prazo de pacientes graves acometidos por sequelas de internação por insuficiência respiratória aguda hipoxêmica com suspeita de Covid-19. ;Pós-covid;Condições Pós-Covid;Pesquisa Clínica Intervencional (Fases I, II, III);PROADI - SUS;Associação Hospitalar Moinhos de Vento;HMV;RS;4818441,2;Em execução;2025
28;2022;Avaliação do impacto de estratégias de reabilitação e alta precoces após insuficiência respiratória em pacientes com suspeita de Covid-19 (RCT Rehab).;Avaliar o impacto de intervenções precoces (incluindo pacotes-bundles) específicos de prevenção/reabilitação precoce e estratégias de desospitalização) em desfechos de interesse de curto prazo e longo prazo em pacientes graves acometidos por sequelas de internação por insuficiência respiratória aguda hipoxêmica com suspeita de Covid-19. ;Pós-covid;Condições Pós-Covid;Pesquisa Clínica Intervencional (Fases I, II, III);PROADI - SUS;Sociedade Beneficente Israelita Brasileira Hospital Albert Einstein;SBIBAE;SP;4474087,09;Finalizado;2023
29;2023;Avaliação do impacto de estratégias de reabilitação e alta precoces após insuficiência respiratória em pacientes acometidos por Síndrome Respiratória Aguda Grave com uso de Ventilação Mecânica.;Avaliar o impacto de intervenções precoces (incluindo pacotes-bundles) específicos de prevenção/reabilitação precoce e estratégias de desospitalização em desfechos de interesse de curto prazo e longo prazo em pacientes graves acometidos por sequelas de internação por insuficiência respiratória aguda hipoxêmica submetidos à ventilação mecânica, com suspeita de Covid-19.;Pós-covid;Condições Pós-Covid;Pesquisa Clínica Intervencional (Fases I, II, III);PROADI - SUS;Sociedade Beneficente Israelita Brasileira Hospital Albert Einstein;SBIBAE;SP;7915361,41;Finalizado;2025
30;2020;Uso de equipamentos de proteção individual pelos profissionais de saúde no combate à Covid-19;Avaliar a adesão e o uso de Equipamentos de Proteção Individual (EPI) por profissionais da Atenção Primária à Saúde (APS) e profissionais vinculados a programas de residência na área da saúde no combate à pandemia da Covid-19, bem como os fatores de risco relacionados.;Prevenção;Outros estudos de prevenção;Pesquisa Observacional;Sem programa vinculado;Universidade Federal de Juiz de Fora;UFJF;MG;58000;Finalizado;2023
31;2020;A eficacia anti-viral da biofotonica como tecnologia para descontaminacao de ambientes e superficies. revisao sistematica.;Avaliar o uso da biofotônica como terapia antiviral discutindo sua utilidade na descontaminação viral de superfícies no contexto da pandemia de Covid-19.;Prevenção;Outros estudos de prevenção;Avaliação de Tecnologias em Saúde;Sem programa vinculado;Universidade Nove de Julho;UNINOVE;SP;50000;Finalizado;2021
32;2020;A eficácia da heparina e do tocilizumabe na melhora clínica de pacientes com infecção grave pela Covid-19: um ensaio clínico multicêntrico randomizado (hepmab-Covid-19 trial);Avaliar se o uso precoce da associação entre heparina e tocilizumabe resulta na melhora clínica dos pacientes com Covid-19 grave, definida pela alta hospitalar ou redução de pelo menos 2 pontos na escala ordinal modificada de 7 pontos da OMS, em 30 dias após a randomização;Tratamento;Medicamentos;Pesquisa Pré-Clínica;Sem programa vinculado;Universidade de São Paulo;USP;SP;2312120;Finalizado;2022
33;2020;A receptividade as fake news e o engajamento no combate a Covid-19: o papel de variaveis cognitivas e socioemocionais;Investigar a relação entre fatores socioemocionais, receptividade a fake news sobre Covid-19 e engajamento em comportamentos de combate à pandemia;Projetos Transversais;Enfrentamento à desinformação em Saúde;Pesquisa Observacional;Sem programa vinculado;Universidade São Francisco;USF;SP;111792,04;Finalizado;2023
34;2020;A saúde dos trabalhadores da saúde no contexto da pandemia do Covid-19: prevenção e cuidado;Analisar a saúde e segurança dos trabalhadores da saúde que atuam no enfrentamento da pandemia de Covid-19 no Nordeste do Brasil. A pesquisa investigou os impactos da pandemia na saúde mental e nas condições de trabalho desses profissionais e buscou desenvolver estratégias para a prevenção e promoção da saúde mental desses trabalhadores.;Projetos Transversais;Impactos na Saúde Mental;Pesquisa Observacional;Sem programa vinculado;Universidade Federal da Paraíba;UFPB;PB;619050;Finalizado;2022
35;2020;Acompanhamento longitudinal de adultos e idosos que receberam alta da internacao hospitalar por Covid-19;Analisar preditores, sequelas e repercussões da Covid-19 em adultos e idosos que desenvolveram a forma grave da doença, após alta hospitala;Pós-covid;Condições Pós-Covid;Pesquisa Observacional;Sem programa vinculado;Universidade Estadual de Maringá;UEM;PR;332413;Finalizado;2022
