id;ano_contratacao;titulo;objetivo;grupo_tematico;subgrupo_tematico;tipo_pesquisa;programa;instituicao;sigla_instituicao;uf_instituicao;valor_projeto;status;ano_previsao
82;2020;Ensaio clínico randomizado para avaliar a efetividade da aplicação de um conjunto de intervenções não farmacológicas para Covid-19 em indivíduos privados de liberdade e agentes de segurança prisional;Avaliar a efetividade de intervenções não farmacológicas (INFs) da Covid-19 em indivíduos privados de liberdade e agentes de segurança prisional do estado de Goiás, Brasil Central;Tratamento;Terapias não medicamentosas;Pesquisa Clínica Intervencional (Fases I, II, III);Sem programa vinculado;Universidade Federal de Goiás;UFG;GO;453732;Finalizado;2023
83;2020;Epidemiologia baseada no monitoramento de esgoto sanitário como alternativa de detecção precoce de surtos virais;Desenvolver um método de baixo custo e rápida resposta, permitindo a criação de mapas georreferenciados e boletins informativos.;Fortalecimento do SUS e Vigilância em Saúde;Epidemiologia;Pesquisa Observacional;Sem programa vinculado;Universidade Federal do ABC;UFABC;SP;521268;Finalizado;2022
84;2020;Epidemiologia e evolução da infecção pelo SARS-CoV-2 na população indígena do mato grosso do sul;Avaliar a porcentagem de infectados, taxa de letalidade e características imunológicas do SARS-CoV-2 na população indígena do Mato Grosso do Sul, promovendo ações para minimizar o impacto. Em paralelo, conduzimos um estudo molecular com sequenciamento de cepas, associando dados genômicos aos desfechos clínicos;Fortalecimento do SUS e Vigilância em Saúde;Epidemiologia;Pesquisa Observacional;Sem programa vinculado;Universidade Federal da Grande Dourados;UFGD;MS;881711,5;Finalizado;2023
85;2020;Estratégias da gestão municipal no combate ao Covid-19 na atenção primária: estudo em minas gerais;Analisar as atividades realizadas na Atenção Primária em Saúde (APS) pelos gestores municipais em Minas Gerais.;Fortalecimento do SUS e Vigilância em Saúde;Sistemas e serviços de saúde;Avaliações de Políticas;Sem programa vinculado;Universidade Federal de São João del-Rei;UFSJ;MG;30190;Finalizado;2023
86;2020;Estratégias para melhorar o conhecimento público, conscientização e confiança nas medidas de prevenção e controle da Covid-19 e outras síndromes respiratórias agudas graves: uma revisão sistemática de método misto;Identificou as estratégias mais efetivas para melhorar aceitabilidade, adesão cumprimento, conhecimentos, atitudes e práticas (CAP), a conscientização e a credibilidade pública quanto à Covid-19 e a outras síndromes respiratórias agudas graves (SARS), bem como os fatores relacionados aos indicadores de resultado;Prevenção;Outros estudos de prevenção;Pesquisa Observacional;Sem programa vinculado;Universidade Estadual Paulista Júlio de Mesquita Filho;UNESP;SP;42600;Finalizado;2021
87;2020;Estudo aberto, prospectivo, randomizado, controlado e adaptativo na segurança e eficácia do tratamento com inibidor de IL-6 verSUS inibidor de IL-17 verSUS baixas doses de IL-2 verSUS tratamento padrão em pacientes hospitalizados com manifestações graves de Covid-19;Avaliar novos fármacos que pudessem alterar a história natural da doença, especialmente nos indivíduos mais vulneráveis.;Tratamento;Medicamentos;Avaliações de Políticas;Sem programa vinculado;Universidade de São Paulo;USP;SP;3347400;Finalizado;2022
88;2020;Estudo brasileiro de pacientes com doenc?as inflamato?rias cro?nicas imunomediadas infectados pelo novo coronavírus 2019 (severe acute respiratory syndrome coronavírus 2 - SARS-CoV-2): reumacov brasil;Avaliar a evolução de pacientes com doenças reumáticas imunomediadas (DRIM), infectados por Sars-Cov-2 e descreveu o curso da infecção nesses pacientes, bem como o impacto na atividade de doença e a influência de características da DRIM e/ ou de seu tratamento com os medicamentos modificadores do curso da doença MMCD (sintéticos, alvo específicos e biológicos) sobre o curso da infecção.;Diagnóstico e Prognóstico;Fisiopatologia da Covid-19;Pesquisa Observacional;Sem programa vinculado;Hospital das Clínicas da Universidade Federal de Pernambuco;HC-UFPE;PE;502562,2;Finalizado;2022
89;2020;Estudo da história natural e efeitos adversos da epidemia de Covid-19 na saúde da população de um grande centro urbano;"Identificou os efeitos da pandemia de Covid-19 na saúde física e mental dos indivíduos; estimou a soroprevalência da infecção por SARS-CoV-2 em diferentes estratos sociais da população de uma cidade brasileira de médio porte; e verificou a sua relação com as condições de vida e aspectos psicossociais";Fortalecimento do SUS e Vigilância em Saúde;Epidemiologia;Pesquisa Observacional;Sem programa vinculado;Universidade Federal da Bahia;UFBA;BA;668900;Finalizado;2022
90;2020;Estudo da variabilidade de co-infecção em pacientes com SARS-CoV-2 e de seus efeitos sobre os diferentes desfechos clínicos da doença;Investigar como a microbiota respiratória influencia a progressão clínica da Covid-19, explorando detalhadamente sua diversidade, composição e funções metabólicas por meio de abordagens multi-ômicas avançadas e integrando informações sobre coinfecções com outros patógenos;Diagnóstico e Prognóstico;Fisiopatologia da Covid-19;Pesquisa Observacional;Sem programa vinculado;Sociedade Beneficente Israelita Brasileira Hospital Albert Einstein;SBIBAE;SP;1861068;Finalizado;2022
91;2020;Estudo de prevalência, de vigilância epidemiológica e de biomarcadores da infecção por SARS-CoV-2 em áreas urbana e indígena no estado do pará;Descreveu a frequência do Sars-Cov-2, os aspectos epidemiológicos de risco para a exposição ao vírus entre comunidades de diferentes estratos populacionais localizados no Estado do Pará (Brasil) e a correlação dos marcadores virais e epidemiológicos com marcadores da resposta imunológica e inflamatória.;Fortalecimento do SUS e Vigilância em Saúde;Epidemiologia;Pesquisa Observacional;Sem programa vinculado;Universidade Federal do Pará;UFPA;PA;1740000;Finalizado;2022
92;2020;Estudo fase iib para avaliar eficacia e seguranca de succinato sodico de metilprednisolona injetavel no tratamento de pacientes com sinais de srag, no ambito do novo coronavírus: um ensaio clínico, duplo-cego, randomizado, controlado com placebo;Avaliar a eficácia da Metilprednisolona (MP), comparado ao tratamento com placebo, na prevenção da morte em pacientes internados em um centro público de referência para o manejo de pacientes com Covid-19 em Manaus.;Tratamento;Medicamentos;Pesquisa Clínica Intervencional (Fases I, II, III);Sem programa vinculado;Fundação de Medicina Tropical Heitor Vieira Dourado;FMTHVD;AM;2441600;Finalizado;2022
93;2020;Estudo multicêntrico de infecção respiratória aguda grave durante a pandemia de Covid-19 em pacientes internados em unidades de terapia intensiva pediátricas brasileiras;Descreveu o perfil de detecção viral e as características clínicas de pacientes pediátricos que desenvolveram infecção respiratória aguda grave durante a pandemia de 2020 pelo novo coronavírus.;Diagnóstico e Prognóstico;Fisiopatologia da Covid-19;Pesquisa Observacional;Sem programa vinculado;Instituto D'Or de Pesquisa e Ensino;IDOR;SP;413745,95;Finalizado;2022
94;2020;Estudo multicêntrico para a vigilância de SARS-CoV-2 em animais de companhia com interface à saúde única (petcovid-19 study): coorte prospectiva de mamíferos domiciliados para avaliação de risco de transmissão zooantroponótica no brasil;"Realizou o diagnóstico laboratorial e monitoramento da infecção em cães e gatos de tutores positivos para Covid-19; analisar os fatores associados à infecção nos animais positivos de forma multicêntrica; e elucidar aspectos relacionados com a infecção do Sars-Cov-2 em animais de companhia na relação humano-animal no Brasi";Fortalecimento do SUS e Vigilância em Saúde;Epidemiologia;Pesquisa Observacional;Sem programa vinculado;Universidade Federal do Paraná;UFPR;PR;597781;Finalizado;2022
95;2020;Estudo multinacional sobre a prática de uso de máscara facial entre o público em geral durante a pandemia da Covid-19;Avaliar a prática do uso de máscara facial entre adultos no Brasil durante a pandemia da Covid-19;Prevenção;Outros estudos de prevenção;Pesquisa Observacional;Sem programa vinculado;Universidade Federal Fluminense;UFF;RJ;148000;Finalizado;2023
96;2020;Estudo prospectivo e multicêntrico dos fatores preditivos de mortalidade hospitalar e carga de doença da sindrome respiratoria aguda grave;Identificar os fatores preditivos independentes da mortalidade hospitalar e longo prazo por SRAG de diferentes etiologias.;Fortalecimento do SUS e Vigilância em Saúde;Epidemiologia;Pesquisa Observacional;Sem programa vinculado;Universidade do Extremo Sul Catarinense;UNESC;SC;1774680;Finalizado;2023
97;2020;"Evolução tardia (maior ou igual a 3 meses) da função ventricular em pacientes infectados por Covid-19 com acometimento miocardico agudo: avaliação clínica, laboratorial e por imagem;";Avaliar a evolução clínica e funcional do coração em pacientes com Covid-19 que desenvolveram injúria miocárdica aguda sem obstrução coronária, tanto na fase hospitalar quanto no seguimento tardio (? 3 meses após a alta).;Diagnóstico e Prognóstico;Fisiopatologia da Covid-19;Pesquisa Observacional;Sem programa vinculado;Fundação Adib Jatene;FAJ;SP;216427;Finalizado;2022
98;2020;Fatores associados ao absenteísmo de profissionais da saúde diretamente envolvidos no enfrentamento da pandemia de Covid-19 e consequências para o sistema de saúde: revisão sistemática;Forneceu dados que contribuíssem com a base de evidências dos vestígios físicos, mentais e psicossociais deixados pela pandemia da Covid-19 em profissionais de saúde.;Fortalecimento do SUS e Vigilância em Saúde;Sistemas e serviços de saúde;Sínteses de Evidências;Sem programa vinculado;Universidade Federal do Amazonas;UFAM;AM;35699,8;Finalizado;2021
99;2020;Ferramentas simples para diagnóstico e prognóstico da Covid-19 no SUS utilizando sintomas e saturação de oxigênio;Desenvolver escores simples de diagnóstico e prognóstico para apoio na triagem dos pacientes com sintomas respiratórios e para orientar o prognóstico de pacientes com Covid-19.;Diagnóstico e Prognóstico;Desenvolvimento de Testes;Pesquisa Translacional;Sem programa vinculado;Fundação Oswaldo Cruz;FIOCRUZ;PR;586647;Finalizado;2022
100;2020;Heparinas: interações com SARS-CoV-2 e atividades anticoagulantes, antivirais e anti-inflamatórias para tratamento da Covid-19;Explorou a atividade antiviral de preparações de heparinas desenvolvidas pelo grupo de pesquisa utilizando células Vero-E6 e células pulmonares humanas.;Tratamento;Medicamentos;Pesquisa Pré-Clínica;Sem programa vinculado;Universidade Federal do Rio de Janeiro;UFRJ;RJ;1461600;Finalizado;2022
101;2020;Identificação de SARS-CoV-2 em corpos d’água e esgoto como ferramenta para estimativa de contágio por Covid-19 da população;Caracterizou, no esgoto e em diferentes corpos d’água, a presença e a concentração do Sars-Cov-2, utilizando os resultados como uma ferramenta complementar à testagem da população para avaliar o seu nível de contaminação;Fortalecimento do SUS e Vigilância em Saúde;Vigilância Genômica;Pesquisa Translacional;Sem programa vinculado;Serviço Nacional de Aprendizagem Industrial;SENAI;DF;1455548;Finalizado;2023
102;2020;Impacto da monitorizacao remota da oximetria e frequência cardíaca em pacientes internados em isolamento por Covid-19;Criar um sistema simples e prontamente disponível para monitorar a SPO2 em pacientes internados na enfermaria e testar sua viabilidade.;Tratamento;Manejo Clínico pacientes com COVID-19;Pesquisa Translacional;Sem programa vinculado;Universidade de São Paulo;USP;SP;54000;Finalizado;2022
103;2020;Impacto da pandemia de Covid-19 na saúde mental de crianças e adolescentes: fatores de risco e proteção;Avaliar a saúde mental de crianças e adolescentes durante o período da pandemia de Covid-19.;Projetos Transversais;Impactos na Saúde Mental;Pesquisa Observacional;Sem programa vinculado;Universidade Federal de Minas Gerais;UFMG;MG;408000;Finalizado;2022
104;2020;Impacto da Covid-19 na gestação, parto e puerpério: scoping review;Analisar as evidências disponíveis na literatura acerca da temática “infecção pelo coronavírus (Covid-19)” entre gestantes e puérperas e transmissão vertical.;Tratamento;Manejo Clínico pacientes com COVID-19;Sínteses de Evidências;Sem programa vinculado;Universidade Federal do Triângulo Mineiro;UFTM;MG;17192,52;Finalizado;2021
105;2020;Impacto epidemiológico do Covid-19 no sistema prisional na cidade de salvador, bahia, brasil;Caracterizou o impacto da pandemia do Covid-19 nos serviços de atenção à saúde no sistema prisional de Salvador.;Fortalecimento do SUS e Vigilância em Saúde;Sistemas e serviços de saúde;Pesquisa Observacional;Sem programa vinculado;"Universidade do Estado da Bahia	";UNEB;BA;182120;Finalizado;2022
106;2020;Indicações para uso preciso e adequado de equipamentos de proteção individual (epis) para profissionais de saúde – revisão sistemática;Identificou, avaliou sistematicamente e resumiu as evidências científicas disponíveis sobre eficácia, segurança, uso seguro e reuso de equipamentos de proteção individual (máscaras, face shield e óculos) para os profissionais da saúde frente à infecção pelo Sars-Cov-2.;Prevenção;Outros estudos de prevenção;Sínteses de Evidências;Sem programa vinculado;Universidade Federal de São Paulo;UNIFESP;SP;38848;Finalizado;2021
107;2020;Influência do isolamento social decorrente da pandemia do Covid-19 nas escolhas alimentares de mulheres de diferentes estados nutricionais;"Avaliar a influência da quarentena e isolamento social por Covid-19 sobre os determinantes das escolhas alimentares de mulheres de diferentes estados nutricionais: perfil socioeconômico, hábitos e consumo alimentar, sintomas de episódios de compulsão alimentar, atitudes alimentares, depressão, ansiedade e estresse; Sentimento percebido de solidão de mulheres de diferentes estados nutricionais";Fortalecimento do SUS e Vigilância em Saúde;Impactos Sociais e Econômicos;Pesquisa Observacional;Sem programa vinculado;Universidade de São Paulo;USP;SP;14396;Finalizado;2022
108;2020;Influência do padrão de atividade física e nível sérico de vitamina d nos desfechos da Covid-19: estudo caso-controle multicêntrico;Avaliar a influência da prática de atividade física e dos níveis séricos de vitamina D sobre os desfechos da Covid-19.;Tratamento;Manejo Clínico pacientes com COVID-19;Pesquisa Observacional;Sem programa vinculado;Instituto de Medicina Integral Prof. Fernando Figueira;IMIP;PE;61168;Finalizado;2022
109;2020;Infodemia e desinformação: revisão sistemática de literatura sobre estratégias de comunicação e informação em saúde em situações de pandemia;Pesquisou e analisou, de forma sistematizada, a produção científica nacional e internacional que apresente evidências sobre produção, circulação e consumo de informação e desinformação relacionadas a crises sanitárias, desastres que apresentem ameaça à saúde coletiva e campanhas de promoção da saúde em situações de crise epidemiológica, e as formas de combatê-las.;Projetos Transversais;Enfrentamento à desinformação em Saúde;Sínteses de Evidências;Sem programa vinculado;Universidade Federal do Rio de Janeiro;UFRJ;RJ;49800;Finalizado;2021
110;2020;Inquérito sorológico de infecção pelo novo coronavírus (SARS-CoV-2) e fatores associados em diferentes grupos etários (epicovid-19-piauí);Estimou a magnitude e evolução da soroprevalência de infecção por Sars-Cov-2 e sua associação com aspectos epidemiológicos em diferentes grupos etários no estado do Piauí.;Fortalecimento do SUS e Vigilância em Saúde;Epidemiologia;Pesquisa Observacional;Sem programa vinculado;Universidade Federal do Piauí;UFPI;PI;1632512;Finalizado;2023
111;2020;Inteligência artificial para decisões clínicas e administrativas durante a pandemia de Covid-19;Avaliar a capacidade preditiva de algoritmos de machine learning para apoiar decisões clínicas e administrativas durante a pandemia de Covid-19, com foco na predição de desfechos como internação em UTI, ventilação mecânica e óbito;Fortalecimento do SUS e Vigilância em Saúde;Sistemas e serviços de saúde;Pesquisa Translacional;Sem programa vinculado;Universidade de São Paulo;USP;SP;196275;Finalizado;2023
112;2020;Interface comunicação-saúde no combate à pandemia da Covid-19: gestão de conteúdo nas mídias sociais, combate às fake news e agendamento midiático;Identificou e analisou as estratégias de comunicação adotadas pela Fundação Oswaldo Cruz (Fiocruz) e pela Secretaria Estadual de Saúde da Paraíba (SES-PB), para gestão de conteúdo nas mídias sociais, como Instagram e Whatsapp, no enfrentamento às fake news e ações de prevenção sobre a pandemia Covid-19.;Projetos Transversais;Enfrentamento à desinformação em Saúde;Pesquisa Não Clínica;Sem programa vinculado;Universidade Federal da Paraíba;UFPB;PB;43919;Finalizado;2022
113;2020;Investigação de marcadores neuroinflamatórios e de dano neuronal e suas relações com transtornos neuropsiquiátricos em sujeitos positivos para Covid-19;Investigar a associação de marcadores inflamatórios e de dano neuronal e suas relações com transtornos neuropsiquiátricos em sujeitos positivos para Covid-19;Diagnóstico e Prognóstico;Fisiopatologia da Covid-19;Pesquisa Observacional;Sem programa vinculado;Universidade do Extremo Sul Catarinense;UNESC;SC;809893,94;Finalizado;2022
114;2020;Lesões de pele relacionadas ao uso de produtos e equipamentos de protecao individual em profissionais de saúde no contexto da Covid-19: estudo caso-controle;Investigar os fatores associados ao desenvolvimento de lesões de pele em profissionais de saúde no contexto da Covid-19;Fortalecimento do SUS e Vigilância em Saúde;Sistemas e serviços de saúde;Pesquisa Observacional;Sem programa vinculado;Universidade Federal Fluminense;UFF;RJ;32035,2;Finalizado;2023
115;2020;Manifestações neurológicas agudas associadas ao vírus SARS-CoV-2;Caracterizou o perfil epidemiológico, clínico, laboratorial, eletrofisiológico e radiológico de pacientes acometidos por síndromes neurológicas como mielite, acidente vascular cerebral (AVC), encefalite e/ou polineuropatia periférica aguda em vigência de epidemia associada ao vírus Sars-Cov-2;Tratamento;Manejo Clínico pacientes com COVID-19;Pesquisa Observacional;Sem programa vinculado;Universidade de São Paulo;USP;SP;436000;Finalizado;2023
116;2020;Modelagem da dinâmica de transmissão do SARS-CoV-2 no brasil: ciência em tempo real para subsidiar gestores na tomada de decisão baseada em evidências;Estimou a transmissão do Sars-Cov-2 na população considerando diferentes tipos de modelos e modelar cenários alternativos ao longo do tempo, considerando implementação de medidas de controle variadas, a fim de subsidiar gestores de saúde para a tomada de decisão baseada em evidências;Fortalecimento do SUS e Vigilância em Saúde;Epidemiologia;Pesquisa Observacional;Sem programa vinculado;Universidade Federal de Goiás;UFG;GO;956280;Finalizado;2023
117;2020;Modelos de vigilância em saúde da Covid-19 e outras síndromes respiratórias agudas graves: revisão de escopo;Caracterizou modelos de vigilância em saúde para Covid-19 e outras síndromes respiratórias agudas graves (SRAG) com base na literatura científica e documentos oficiais de agências e instituições de saúde multilaterais, regionais e nacionais.;Fortalecimento do SUS e Vigilância em Saúde;Epidemiologia;Sínteses de Evidências;Sem programa vinculado;Universidade Federal do Rio de Janeiro;UFRJ;RJ;73517;Finalizado;2021
118;2020;Monitoramento, mapeamento e elaboração de sistema de alerta precoce para Covid-19 via análise de cargas virais em águas residuárias urbanas;Implementar a Epidemiologia Baseada do Esgoto para produzir dados empíricos e em tempo quase-real sobre a presença de Sars-Cov-2 em escala comunitária em apoio aos sistemas de vigilância em saúde.;Fortalecimento do SUS e Vigilância em Saúde;Vigilância Genômica;Pesquisa Translacional;Sem programa vinculado;Universidade de Brasília;UNB;DF;401000;Finalizado;2022
119;2020;Nanopartículas de ouro bioconjugadas com anticorpos para a detecção de SARS-CoV-2 pela técnica de espalhamento de luz dinâmico (DLS);"Desenvolver um método para a detecção do vírus SARS-CoV-2 usando como leitor a técnica de espalhamento dinâmico de luz (DLS); padronizar e validar um imunoteste baseado em reação de aglutinação do SARS-CoV-2 por nanopartículas de ouro funcionalizadas com anticorpos anti-glicoproteína spike do vírus.";Diagnóstico e Prognóstico;Desenvolvimento de Testes;Pesquisa Translacional;Sem programa vinculado;Universidade de Brasília;UNB;DF;2000000;Finalizado;2022
120;2020;Nanotecnologia aplicada para a imunização contra a Covid-19;Produzir de forma econômica e sustentável uma vacina contra a Covid-19 com nanopartículas funcionalizadas com antígenos do vírus SARS-CoV-2.;Prevenção;Vacinas e Imunização;Pesquisa Pré-Clínica;Sem programa vinculado;Universidade Federal do Paraná;UFPR;PR;237600;Finalizado;2022
121;2020;O uso de big data para avaliação da efetividade de intervencoes nao farmacologicas no enfrentamento de epidemias e seus impactos economicos;O objetivo geral desse projeto é utilizar big data para avaliar a efetividade de estratégias de INF no combate à epidemia de Covid-19 e seus impactos diretos e indiretos nas condições de saúde e atividade econômica dos municípios brasileiros;Prevenção;Outros estudos de prevenção;Pesquisa Observacional;Sem programa vinculado;Universidade Estadual de Campinas;UNICAMP;SP;46520;Finalizado;2022
122;2020;Obitos hospitalares relacionados a Covid-19 no sistema unico de saúde e a capacidade instalada das regioes de saude: um estudo nacional;Analisar a associação entre os óbitos hospitalares relacionados à Covid-19 no Sistema Único de Saúde (SUS) e a capacidade instalada das regiões de saúde para atendimento de casos graves, bem como dimensionar a lacuna existente entre essa capacidade instalada e a demanda futura durante a vigência da Emergência em Saúde Pública de Importância Nacional (ESPIN).;Fortalecimento do SUS e Vigilância em Saúde;Sistemas e serviços de saúde;Pesquisa Observacional;Sem programa vinculado;Fundação Universidade de Brasília;FUB;DF;334476;Finalizado;2022
123;2020;Óxido nítrico inalado para tratamento de infecao por SARS-CoV-2: um ensaio clínico aberto, multicêntrico, paralelo, multicêntrico e randomizado.;Avaliar, em hospitais do SUS, a eficácia clínica e a custo-efetividade de uma única sessão de 6 h de óxido nítrico inalado a 160 ppm, comparada ao tratamento padrão, na redução do tempo de oxigenoterapia e da duração da internação de adultos com Covid-19 moderada, gerando evidências para eventual incorporação da terapia nos Protocolos Clínicos e Diretrizes Terapêuticas nacionais.;Tratamento;Terapias não medicamentosas;Pesquisa Clínica Intervencional (Fases I, II, III);Sem programa vinculado;União Brasileira de Educação e Assistência;UBEA;RS;237700;Finalizado;2022
124;2020;Papel dos metabolitos microbianos na infeccao pulmonar causada por SARS-CoV-2, atraves da modulacao a microbiota e do sistema imune;Elucidar o papel da microbiota intestinal e de seus metabólitos na resposta imune durante a infecção por SARS-CoV-2, explorando possíveis mecanismos de proteção ou agravamento da Covid-19.;Tratamento;Manejo Clínico pacientes com COVID-19;Pesquisa Translacional;Sem programa vinculado;Universidade Federal de Minas Gerais;UFMG;MG;422500;Finalizado;2022
125;2020;Patogenia e historia natural da Covid-19: uma abordagem baseada em autopsias;Criar e consolidar um dos maiores e mais diversificados biorepositórios de tecido humano de pacientes com Covid-19, obtido por autópsia minimamente invasiva guiada por ultrassom, como base para pesquisas translacionais e clínicas voltadas ao entendimento da infecção pelo SARS-CoV-2, sua fisiopatogenia e alvos terapêuticos.;Tratamento;Manejo Clínico pacientes com COVID-19;Pesquisa Translacional;Sem programa vinculado;Universidade de São Paulo;USP;SP;1385600;Finalizado;2023
126;2020;Plasma convalescente (pconv) como terapia de prevenção de complicacoes associadas a infeccao por SARS-CoV-2;Avaliar segurança e eficácia do uso de plasma convalescente no tratamento da Covid-19;Tratamento;Terapias não medicamentosas;Pesquisa Clínica Intervencional (Fases I, II, III);Sem programa vinculado;Universidade Estadual de Campinas;UNICAMP;SP;431974;Finalizado;2022
127;2020;Por uma terra sem males: educação em saúde para o enfrentamento das fake news e da Covid-19 na terra indigena karitiana, porto velho/ro.;Inventariar os impactos de notícias falsas (fake news) sobre a adesão do povo indígena karitiana em relação às medidas de prevenção à Covid-19 orientadas pelo Ministério da Saúde.;Projetos Transversais;Enfrentamento à desinformação em Saúde;Pesquisa Não Clínica;Sem programa vinculado;Instituto Federal de Educação, Ciência e Tecnologia de Rondônia;IFRO;RO;50000;Finalizado;2022
