id;ano_contratacao;titulo;objetivo;grupo_tematico;subgrupo_tematico;tipo_pesquisa;programa;instituicao;sigla_instituicao;uf_instituicao;valor_projeto;status;ano_previsao
128;2020;Produção de quimeras vacinais (SARS-CoV-2-yfv17d) contra o virus SARS-CoV-2 (severe acute respiratory syndrome coronavírus 2) e padronizaçãoo de testes sorologicos;Desenvolvimento de uma vacina recombinante utilizando como plataforma o vírus da febre amarela 17D (YFV 17D).;Prevenção;Vacinas e Imunização;Pesquisa Pré-Clínica;Sem programa vinculado;Universidade Federal de Viçosa;UFV;MG;464712;Finalizado;2022
129;2020;Prognóstico funcional em adultos e idosos acometidos pela Covid-19: estudo de coorte;Avaliar os fatores preditores de prognósticos clínico e funcional de adultos e idosos com diagnóstico de Covid-19.;Tratamento;Manejo Clínico pacientes com COVID-19;Pesquisa Observacional;Sem programa vinculado;Universidade de São Paulo;USP;SP;425984;Finalizado;2023
130;2020;Re2scue: reabilitação respiratoria em sobreviventes do Covid-19: um estudo clínico randomizado.;Avaliar um programa de reabilitação respiratória de seis semanas em sobreviventes da Covid-19, visando melhorar a função respiratória, resistência à fadiga, qualidade de vida e estado psicológico, além de promover a formação de especialistas e fortalecer a atenção à saúde respiratória no sul de Santa Catarina.;Tratamento;Terapias não medicamentosas;Pesquisa Clínica Intervencional (Fases I, II, III);Sem programa vinculado;Universidade Federal de Santa Catarina;UFSC;SC;108678,82;Finalizado;2023
131;2020;Reatividade cruzada de anticorpos desenvolvidos apos a vacinacao com triplice viral com as proteinas do SARS-CoV-2.;Investigar a possível reatividade cruzada de anticorpos dirigidos aos determinantes antigênicos da vacina tríplice viral com os determinantes antigênicos do vírus SARS-CoV2.;Prevenção;Vacinas e Imunização;Pesquisa Pré-Clínica;Sem programa vinculado;Fundação Oswaldo Cruz;FIOCRUZ;PR;314000;Finalizado;2022
132;2020;Recomendações técnicas, saberes e práticas populares no enfrentamento da Covid-19 em zona rural;Investigar e desenvolver estratégias criativas e inovadoras para prevenção e controle da Covid-19 junto a comunidades rurais;Prevenção;Outros estudos de prevenção;Pesquisa Não Clínica;Sem programa vinculado;Universidade Federal Fluminense;UFF;RJ;26205;Finalizado;2022
133;2020;Rede colaborativa do instituto butantan para o desenvolvimento de candidatos vacinais contra SARS-CoV-2;Definir, por modelagem molecular computacional e análise de bioinformática, sequências genômicas de SARS-CoV-2 candidatas a vacinas de subunidade e quimeras multi-epítopo.;Prevenção;Vacinas e Imunização;Pesquisa Pré-Clínica;Sem programa vinculado;Instituto Butantan;IBU;SP;1283802;Finalizado;2022
134;2020;Rede Saúde Única de monitoramento genomico em tempo real: dinâmica evolutiva, de transmissao e dispersão espaço-temporal do SARS-CoV-2 em humanos, animais e no ambiente;O projeto teve por objetivo monitorar a epidemiologia do SARS-CoV-2 no Brasil, analisando sua evolução, transmissão e dispersão espaço-temporal via sequenciamento genômico em tempo real. Foram analisados dados referentes a variabilidade genética, evolução viral, variabilidade intra-hospedeiro, marcadores de gravidade clínica e persistência/excreção viral em diversas amostras clínicas.;Fortalecimento do SUS e Vigilância em Saúde;Vigilância Genômica;Pesquisa Translacional;Sem programa vinculado;Fundação Oswaldo Cruz;FIOCRUZ;PR;1400000;Finalizado;2022
135;2020;Rede para estudos colaborativos sobre a patogenese da Covid-19;Compreender melhor a fisiopatologia da Covid-19 por meio da criação de uma rede multidisciplinar de pesquisa básica e translacional;Tratamento;Manejo Clínico pacientes com COVID-19;Pesquisa Translacional;Sem programa vinculado;Fundação Oswaldo Cruz;FIOCRUZ;PR;1588000;Finalizado;2022
136;2020;Revacinação com BCG de profissionais da saúde atuando na pandemia de Covid-19, estrategia preventiva para melhorar resposta imune inata;Ensaio clínico randomizado para avaliar a eficácia da vacina BCG em profissionais da área da saúde para proteger contra Covid-19 ou diminuir os agravos de saúde;Prevenção;Vacinas e Imunização;Pesquisa Clínica Intervencional (Fases I, II, III);Sem programa vinculado;Universidade Federal de Goiás;UFG;GO;1241028;Finalizado;2022
137;2020;Revisões sistematicas aplicadas ao diagnóstico e terapêutica do Covid-19 e seu potencial na odontologia;Avaliar sistematicamente as evidências existentes sobre diferentes metodologias relacionadas ao diagnóstico, prevenção, controle e tratamento da Covid-19, por meio de exames salivares diagnósticos, análise de possíveis efeitos adversos na cavidade oral com o uso de cloroquina/hidroxicloroquina, utilização de clorexidina para higiene oral de pacientes submetidos à ventilação mecânica e utilização do gás ozônio para desinfecção em ambientes na área de saúde.;Tratamento;Manejo Clínico pacientes com COVID-19;Sínteses de Evidências;Sem programa vinculado;Universidade Federal De Uberlandia;UFU;MG;49824,96;Finalizado;2021
138;2020;Saúde mental de profissionais de enfermagem do brasil no contexto da Covid-19: estudo transversal;Avaliar aspectos da saúde mental dos profissionais de enfermagem (auxiliar/técnico de enf., enfermeiros e obstetrizes) no contexto da pandemia do Covid-19.;Projetos Transversais;Impactos na Saúde Mental;Pesquisa Observacional;Sem programa vinculado;Universidade de São Paulo;USP;SP;96088;Finalizado;2022
139;2020;Saúde mental e aspectos emocionais de profissionais atuantes em unidades de terapia intensiva pediatrica durante a pandemia de Covid-19;Avaliar a saúde mental e emocional de profissionais de saúde atuantes em Unidades de Terapia Intensiva Pediátricas (UTIPs) durante e após o término da pandemia causada pelo novo coronavirus.;Projetos Transversais;Impactos na Saúde Mental;Pesquisa Observacional;Sem programa vinculado;Instituto D'Or de Pesquisa e Ensino;IDOR;SP;251278,95;Finalizado;2022
140;2020;Saúde mental e sobrecarga emocional de profissionais de saúde do brasil envolvidos no atendimento a pacientes portadores de Covid-19: indicadores e fatores associados;O objetivo desse estudo é avaliar e acompanhar a evolução dos indicadores de saúde mental e sobrecarga emocional de profissionais de saúde brasileiros que atuam nos cuidados à portadores de Covid-19 e identificar os fatores de risco e proteção associados.;Projetos Transversais;Impactos na Saúde Mental;Pesquisa Observacional;Sem programa vinculado;Universidade de São Paulo;USP;SP;35000;Finalizado;2022
141;2020;Sintomas nao psicoticos entre profissionais de enfermagem que surgiram no contexto de trabalho da Covid-19.;Avaliar nos profissionais de enfermagem a presença de sintomas não psicóticos que surgiram no contexto de trabalho durante a pandemia.;Projetos Transversais;Impactos na Saúde Mental;Pesquisa Observacional;Sem programa vinculado;Universidade Federal de São Carlos;UFSCAR;SP;29800;Finalizado;2022
142;2020;Soluções para aumentar a aceitabilidade, adesão e cumprimento das medidas de prevenção e controle da Covid-19 na população;Propor soluções para aumentar a adeseão da população às medidas de prevenção e controle da Covid-19 e outras doenças respiratórias aguda graves com base na identificação, na população brasileira, das barreiras de facilitadores para adesão.;Prevenção;Outros estudos de prevenção;Pesquisa Observacional;Sem programa vinculado;Universidade Federal do Rio Grande do Norte;UFRN;RN;112852;Finalizado;2022
143;2020;Um ambiente computacional para combate automático à fake news sobre Covid-19 e outras sars em redes sociais virtuais;O presente projeto teve como objetivos desenvolver, testar e avaliar o AUTOMATA — um protótipo funcional de ambiente computacional voltado ao combate automático à disseminação de fake news sobre a Covid-19 e outras síndromes respiratórias agudas graves (SARS), escritas em Língua Portuguesa e disseminadas em redes sociais virtuais.;Projetos Transversais;Enfrentamento à desinformação em Saúde;Pesquisa Translacional;Sem programa vinculado;Instituto Militar de Engenharia;IME;RJ;136461;Finalizado;2022
144;2020;Uso da espectroscopia por infravermelho no diagnóstico da Covid-19;Desenvolver um novo método de triagem de pacientes com sintomas respiratórios para detecção de Covid-19 com uso de swab orofaringe.;Diagnóstico e Prognóstico;Desenvolvimento de Testes;Pesquisa Translacional;Sem programa vinculado;Universidade Federal do Espírito Santo;UFES;ES;225836;Finalizado;2022
145;2020;Valor prognostico de biomarcadores imunes e inflamatorios em predizer gravidade e mortalidade da Covid-19: revisao sistematica;Buscar, selecionar, avaliar, analisar e relatar sistematicamente os resultados de estudos que testaram o valor prognóstico de biomarcadores imunes e inflamatórios em predizer gravidade e mortalidade da Covid-19;Tratamento;Manejo Clínico pacientes com COVID-19;Sínteses de Evidências;Sem programa vinculado;Universidade Federal do Estado do Rio de Janeiro;UNIRIO;RJ;45796;Finalizado;2022
146;2023;Impacto das variações climáticas na incidência de síndrome respiratória aguda grave em crianças no brasil;Investigar a associação entre mudanças em variáveis climáticas e a incidência de SRAG em crianças no Brasil.;Fortalecimento do SUS e Vigilância em Saúde;Epidemiologia;Pesquisa Observacional;Sem programa vinculado;Fundação Oswaldo Cruz;FIOCRUZ;PR;364560;Em execução;2026
147;2023;A Covid-19 longa no brasil: um estudo etnografico sobre as politicas de reconhecimento e de cuidado de uma sindrome pos-viral;Fazer um estudo etnográfico sobre as políticas de reconhecimento e de cuidado para a Covid-19 Longa no Brasil.;Pós-covid;Condições Pós-Covid;Pesquisa Não Clínica;Sem programa vinculado;Universidade Federal do Rio Grande do Sul;UFRGS;RS;1026000;Em execução;2026
148;2023;Acompanhamento de pacientes pós-covid: utilizacao de metodologias aplicaveis ao SUS para avaliar a qualidade de vida e desfechos na saude;Avaliar o impacto das condições pós-covid na qualidade de vida e desfechos na saude dos pacientes por meio da pesquisa de biomarcadores por metabolômica.;Pós-covid;Condições Pós-Covid;Pesquisa Translacional;Sem programa vinculado;Universidade Federal de Juiz de Fora;UFJF;MG;235880;Em execução;2026
149;2023;Analise das mortes maternas por causas Covid-19 e nao-Covid-19 e impactos sociais da pandemia nos estados da paraiba, pernambuco e alagoas entre os anos 2020 e 2022;Analisar de forma comparativa as mortes maternas por Covid-19 e por causas não-Covid-19 ocorridas nos estados da Paraíba, Pernambuco e Alagoas entre os anos 2020 e 2022.;Fortalecimento do SUS e Vigilância em Saúde;Impactos Sociais e Econômicos;Pesquisa Observacional;Sem programa vinculado;Instituto de Medicina Integral Prof. Fernando Figueira;IMIP;PE;682764;Em execução;2026
150;2023;Analise do impacto dos determinantes sociais de saúde na qualidade de vida e desfechos em saúde da populacao brasileira pós-covid: estudo longitudinal;Avaliar o impacto dos determinantes sociais da saúde na qualidade de vida das pessoas que tiveram diagnóstico de Covid-19.;Fortalecimento do SUS e Vigilância em Saúde;Impactos Sociais e Econômicos;Pesquisa Observacional;Sem programa vinculado;Universidade Federal do Ceará;UFC;CE;227720;Em execução;2026
151;2023;Enfrentando a crise pos-pandemia: integração de abordagens multiomicas para o combate a Covid-19, Covid-19 longa e a resistencia microbiana.;"Identificar potenciais terapêuticos e marcadores diagnósticos e prognósticos mais eficientes e direcionados para manejo clínico da Covid-19 e Covid-19 Longa; bem como determinar e comparar do perfil de mecanismos de resistência entre bactérias nosocomiais no cenário pré e pós-pandemia.";Pós-covid;Condições Pós-Covid;Pesquisa Translacional;Sem programa vinculado;Universidade Federal da Bahia;UFBA;BA;390860;Em execução;2026
152;2023;Estudo longitudinal para analise de marcadores imunologicos, hematologicos, teciduais e imunofenotipicos nas condicoes pós-covid: uma abordagem para a definicao de politicas de diagnóstico, tratamento e vigilância;Contribuir cientificamente para o entendimento do perfil de pessaos com condições pós-covid, cientificamente para a elucidação do envolvimento da resposta imunológica e de marcadores específicos na gravidade e na duração das sequelas antes e após tratamento e, de maneira mais ampla, permitir que este entendimento subsidie a elaboração de condutas de diagnóstico e tratamento pelos órgãos gestores de saúde.;Pós-covid;Condições Pós-Covid;Pesquisa Translacional;Sem programa vinculado;Fundação Oswaldo Cruz;FIOCRUZ;PR;1169843;Em execução;2026
153;2023;Fatores associados ao desenvolvimento de sequelas cardíacas, na sindrome pos-aguda da Covid-19, e potenciais fatores prognosticos em pacientes com essa condicao: uma revisao sistematica;Sintetizar as evidências disponíveis na literatura sobre as condições cardíacas pós-covid.;Pós-covid;Condições Pós-Covid;Sínteses de Evidências;Sem programa vinculado;Universidade de Brasília;UNB;DF;141500;Em execução;2025
154;2023;Impactos sociais e economicos a longo prazo da sindrome pós-covid: os efeitos globais e sistemicos da reducao da aptidao fisica na saude, adoecimento social e capacidade produtiva;Avaliar a prevalência e a evolução de impactos pós-covidna população estudada, incluindo limitações funcionais, sintomas, alterações biopsicossociais e econômicas, e identificar fatores associados a esses desfechos (primários e secundários), no curto e no longo prazo.;Fortalecimento do SUS e Vigilância em Saúde;Impactos Sociais e Econômicos;Pesquisa Observacional;Sem programa vinculado;Universidade Federal do Rio Grande do Sul;UFRGS;RS;1259300;Em execução;2026
155;2023;O impacto dos determinantes sociais em saúde (dss) na resposta e recuperacao do SUS a Covid-19 no brasil;Analisar a relação dos DSS e o processo saúde doença, com especial atenção ao impacto das mudanças no perfil de gestão do SUS na produção hospitalar e ambulatorial e consequente impacto em populações em vulnerabilidade no Brasil.;Fortalecimento do SUS e Vigilância em Saúde;Impactos Sociais e Econômicos;Pesquisa Observacional;Sem programa vinculado;Fundação Getulio Vargas;FGV;RJ;1086900;Em execução;2026
156;2023;Ocorrencia de Covid-19 longa e avaliação de fatores de risco como marcadores prognosticos para desenvolvimento da doenca.;Avaliar a ocorrência de Covid-19 longa e os fatores de risco associados ao desenvolvimento da síndrome em pacientes não hospitalizados.;Pós-covid;Condições Pós-Covid;Pesquisa Observacional;Sem programa vinculado;Universidade Federal de Juiz de Fora;UFJF;MG;670140;Em execução;2026
157;2023;pós-covid e as favelas brasileiras: a abordagem multidimensional e interseccional dos dss no enfrentamento deste epifenomeno e das crises contemporaneas: um estudo multicêntrico em redes colaborativas;"Aprofundar conhecimentos científicos no contexto do pós-covid, para o aprimoramento do SUS, na inclusão dos que vivem em doze
favelas das regiões metropolitanas do ABC Paulista, Belém, Belo Horizonte, Fortaleza, Goiânia, Manaus, Porto Alegre, Recife, Rio de
Janeiro capital e São Paulo capital, considerando os critérios da equidade, da Saúde Única, dos DSS, dos ODS, da APS, da
interseccionalidade em saúde coletiva e da prevenção em novas pandemias.";Fortalecimento do SUS e Vigilância em Saúde;Impactos Sociais e Econômicos;Pesquisa Observacional;Sem programa vinculado;Universidade de São Paulo;USP;SP;1499896;Em execução;2027
158;2023;Sindrome pós-covid: caracterizacao de aspectos clínicos, epidemiologicos, regionais, nutricionais e funcionais envolvidos, e o impacto desta condicao na qualidade de vida dos acometidos.;Investigar, em âmbito nacional, a Síndrome pós-covid (SPC) quanto à incidência na população brasileira, aos aspectos clínicos, epidemiológicos, regionais, nutricionais e funcionais envolvidos, e ao impacto na qualidade de vida, visando identificar marcadores clínicos úteis ao diagnóstico e fatores manejáveis que contribuam para melhor prognóstico.;Pós-covid;Condições Pós-Covid;Pesquisa Observacional;Sem programa vinculado;Universidade Federal do Rio Grande do Sul;UFRGS;RS;194360;Em execução;2027
159;2023;Tecnicas de inteligencia artificial para a identificacao e gestao clínica de casos de Covid-19 longa;Utilizar técnicas de Inteligência Artificial (IA) para auxiliar na identificação e na gestão clínica dos casos de Covid-19 longa.;Pós-covid;Condições Pós-Covid;Avaliação de Tecnologias em Saúde;Sem programa vinculado;Universidade Federal de São Carlos;UFSCAR;SP;204346,7;Em execução;2026
160;2023;Vigilância genômica de patogenos multirresistentes na interface humana-animal-ambiental: uma abordagem de saúde única para compreensao da dinâmica da resistência antimicrobiana em um cenario pós-covid;Compreender a dinâmica da resistência antimicrobiana no cenário pós-covid, no contexto de Saúde Única, por meio da vigilância genômica de microrganismos de origem humana, animal e ambiental.;Fortalecimento do SUS e Vigilância em Saúde;Vigilância Genômica;Pesquisa Observacional;Sem programa vinculado;Instituto Federal do Espírito Santo;IFES;ES;663450;Em execução;2026
161;2023;Concepções e itinerários terapêuticos de adolescentes que tentaram o suicídio no período da pandemia por Covid-19 no município de são paulo;Analisar os itinerários terapêuticos de adolescentes que tentaram suicídio no período da pandemia por Covid-19 na Coordenadoria Regional Sudeste do Município de São Paulo;Projetos Transversais;Impactos na Saúde Mental;Pesquisa Observacional;Sem programa vinculado;Universidade Federal de São Paulo;UNIFESP;SP;125975;Em execução;2026
162;2022;Covid-19 pesquisa de comportamentos – etapa 2: mudanças nos estilos de vida e no estado de saúde dos brasileiros provocadas pela pandemia de Covid-19;Investigar as mudanças nas condições socioeconômicas, nos estilos de vida, no uso de serviços de saúde, e no estado de saúde dos brasileiros após dois anos de pandemia da Covid-19, abordando-se questões relacionadas à pandemia, como a vacinação, infecção pelo SARS-CoV-2 antes e depois da vacinação, sequelas e internações por Covid-19, perdas de familiares e amigos, acesso e uso dos serviços de saúde e problemas psicológicos.;Fortalecimento do SUS e Vigilância em Saúde;Impactos Sociais e Econômicos;Pesquisa Observacional;Sem programa vinculado;Fundação Oswaldo Cruz;FIOCRUZ;PR;493686;Em execução;2026
163;2021;Rede de estudos observacionais para monitoramento da efetividade, imunogenicidade e segurança da vacinação contra Covid-19 no brasil, e história natural da doença em crianças e adolescentes;Avaliar a efetividade, segurança e imunogenicidade da vacinação contra Covid-19 implementada no Brasil, e descrever a história natural da doença em crianças e adolescentes, por meio de uma rede colaborativa de estudos observacionais.;Prevenção;Vacinas e Imunização;Pesquisa Observacional;Sem programa vinculado;Fundação Oswaldo Cruz;FIOCRUZ;PR;64076739;Em execução;2026
164;2020;Prevenção e controle da Covid-19: estudo multicêntrico sobre a percepção e práticas no cotidiano das orientações médico-científicas pela população dos territórios de abrangência da atenção primária à saúde;Analisar como a população dos territórios de abrangência da APS percebe e traduz em práticas do cotidiano nos âmbitos individual, familiar e coletivo as medidas de prevenção e controle da Covid-19.;Fortalecimento do SUS e Vigilância em Saúde;Impactos Sociais e Econômicos;Pesquisa Observacional;PPSUS;Universidade Federal de Alagoas;UFAL;AL;38884;Finalizado;2022
165;2020;Ações intersetoriais para promoção da saúde na estratégia saúde da família: estudo de intervenção para prevenção e controle dos fatores de risco relacionados às doenças cardiovasculares em delmiro gouveia - alagoas;Avaliar as ações intersetoriais voltadas para a promoção da saúde quanto a prevenção e controle dos fatores de riscos para as doenças cardiovasculares no município de Delmiro Gouveia Específicos;Prevenção;Outros estudos de prevenção;Avaliações de Políticas;PPSUS;Universidade Federal de Alagoas;UFAL;AL;62456;Finalizado;2022
166;2020;O comprometimento do olfato, do paladar e da audição e seu impacto na qualidade de vida dos pacientes pós-internados com Covid-19 no estado de alagoas e o desenvolvimento de um novo teste de diagnóstico para o SUS;"Avaliar o comprometimento do olfato, paladar e audição dos pacientes pós-covid no Estado de Alagoas;
Analisar a associação dos distúrbios olfativos, do paladar e/ou auditivos com parâmetros laboratoriais dos pacientes selecionados";Pós-covid;Condições Pós-Covid;Pesquisa Observacional;PPSUS;Universidade Estadual de Ciências da Saúde de Alagoas;UNCISAL;AL;185220;Finalizado;2022
167;2020;Riscos e exigências do/no trabalho em enfermagem no enfrentamento da pandemia de Covid-19 em alagoas;Analisar como os processos de trabalho da/na Enfermagem impactam na saúde das(os) trabalhadoras(es), no contexto de enfrentamento da pandemia da Covid-19 em Alagoas, considerando os riscos e as exigências do trabalho no referido campo profissional.;Fortalecimento do SUS e Vigilância em Saúde;Sistemas e serviços de saúde;Pesquisa Observacional;PPSUS;Universidade Federal de Alagoas;UFAL;AL;44750;Finalizado;2022
168;2020;Testes randomizados de Covid-19: uma alternativa ao teste em massa para monitorar infecções por SARS-CoV-2 na população do amapá, brasil;Levantamento epidemiológico da situação da pandemia de Covid-19 nos municípios da região metropolitana de Macapá e do Oiapoque, através de aplicação de testes rápidos e por RT-PCR tanto na comunidade acadêmica dos Campi da UNIFAP quanto em residências selecionadas aleatoriamente nos municípios da região metropolitana de Macapá e do Oiapoque.;Fortalecimento do SUS e Vigilância em Saúde;Epidemiologia;Pesquisa Observacional;PPSUS;Universidade Federal do Amapá;UNIFAP;AP;49303;Finalizado;2022
169;2020;Avaliação do perfil metabolômico plasmático de pacientes hipertensos e a sua correlação com a Covid-19;Determinar o perfil metabolômico plasmático dos pacientes hipertensos acometidos pela Covid-19 e correlaciona-lo a gravidade da infecção e aos níveis plasmáticos de losartana e do seu metabólito ativo (EXP 3174).;Diagnóstico e Prognóstico;Fisiopatologia da Covid-19;Pesquisa Observacional;PPSUS;Universidade Federal do Amapá;UNIFAP;AP;50000;Finalizado;2022
170;2020;Resiliência de famílias de crianças com necessidades especiais no contexto da pandemia Covid-19 no estado do amapá;Analisar o processo de resiliência de famílias de crianças autista no contexto da pandemia Covid-19 no Estado do Amapá.;Fortalecimento do SUS e Vigilância em Saúde;Impactos Sociais e Econômicos;Pesquisa Observacional;PPSUS;Universidade Federal do Amapá;UNIFAP;AP;21374,1;Finalizado;2022
171;2020;Estudo da assinatura molecular para a determinação de gravidade da doença do coronavírus 2019 (Covid-19);Caracterizar o perfil de expressão gênica, o imunofenótipo, marcadores de vasculopatia e ativação endotelial associado à gravidade do quadro clínico e ao prognóstico da doença Covid-19.;Diagnóstico e Prognóstico;Fisiopatologia da Covid-19;Pesquisa Observacional;PPSUS;Universidade Estadual de Feira de Santana;UEFS;BA;196264,11;Finalizado;2022
172;2020;Monitoramento, informação em tempo real e modelagem para o enfrentamento da Covid-19: pensando a atenção básica de forma integrada em irecê, bahia.;Avaliar o impacto da implementação de um sistema de notificação em tempo real, associado ao monitoramento, vigilância molecular  e à modelagem matemática para a tomada de decisão quanto ao manejo da Covid-19 em Irecê, Bahia, no âmbito da atenção básica.;Fortalecimento do SUS e Vigilância em Saúde;Epidemiologia;Pesquisa Observacional;PPSUS;Fundação Oswaldo Cruz;FIOCRUZ;PR;157768;Finalizado;2022
173;2020;Estratégias e tecnologias para garantir acesso e resolubilidade da APS no contexto da pandemia de Covid-19 na macrorregião de saúde centro-leste.;Avaliar estratégias e tecnologias utilizadas por municípios da Macrorregião Centro - Leste para proporcionar/viabilizar o acesso dos usuários e garantir a resolubilidade das ações e serviços oferecidos pela APS no contexto de distanciamento social.;Fortalecimento do SUS e Vigilância em Saúde;Sistemas e serviços de saúde;Outros;PPSUS;Universidade Estadual de Feira de Santana;UEFS;BA;37684;Finalizado;2022
174;2020;Avaliação dos benefícios das práticas integrativas e/ou complementares no quadro clínico de pacientes portadores do Covid-19;Realizar um ensaio clínico randomizado, triplo-cego para avaliar os benefícios das PICs na melhora clínica, redução da inflamação e no fortalecimento da resposta imunológica de pacientes frente às complicações geradas pelo coronavírus.;Tratamento;Terapias não medicamentosas;Pesquisa Clínica Intervencional (Fases I, II, III);PPSUS;Universidade Federal do Oeste da Bahia;UFOB;BA;179208,87;Finalizado;2022
175;2020;Estratégias de enfrentamento da pandemia Covid-19 em comunidades quilombolas;Analisar estratégias de enfrentamento da pandemia Covid-19 em comunidades Quilombolas;Fortalecimento do SUS e Vigilância em Saúde;Impactos Sociais e Econômicos;Outros;PPSUS;Universidade Federal da Bahia;UFBA;BA;30350;Finalizado;2022
